{
  "schemaVersion": "2026-09-10-ns5-module-v2",
  "moduleName": "comandaRestaurante",
  "title": "Comanda de Restaurante",
  "userLanguage": "pt-BR",
  "productLanguages": [
    "pt-BR"
  ],
  "defaultLanguage": "pt-BR",
  "sourcePrompt": "módulo comandaRestaurante, português. o restaurante tem mesas e um cardápio com itens e preços. o garçom abre uma comanda para uma mesa, lança itens (com quantidade e observação), e pode cancelar um item lançado por engano enquanto a comanda estiver aberta. o caixa fecha a comanda: vê o total, aplica desconto opcional, registra a forma de pagamento e a mesa fica livre. perfis: garçom e caixa.",
  "actors": [
    {
      "actorId": "garcom",
      "kind": "internal",
      "origin": "named",
      "title": "Garçom",
      "description": "Profissional do restaurante que abre comandas para mesas, lança itens e cancela lançamentos realizados por engano enquanto a comanda está aberta."
    },
    {
      "actorId": "caixa",
      "kind": "internal",
      "origin": "named",
      "title": "Caixa",
      "description": "Profissional do restaurante que fecha comandas, aplica descontos opcionais, registra a forma de pagamento e libera a mesa."
    }
  ]
}
