{
  "schemaVersion": "2026-09-10-ns5-module-v2",
  "moduleName": "mensalidadesAcademia",
  "title": "Mensalidades da Academia",
  "userLanguage": "pt-BR",
  "productLanguages": [
    "pt-BR"
  ],
  "defaultLanguage": "pt-BR",
  "sourcePrompt": "criar mensalidadesAcademia em português. academia com alunos e planos (mensal, trimestral, anual, com valor e dia de vencimento). a recepção matricula o aluno em um plano a partir de uma data. todo mês a gerência gera as mensalidades do mês para todos os alunos ativos, uma por aluno, com valor do plano e vencimento. a recepção registra pagamentos (data, valor, forma). mensalidade não paga após o vencimento fica vencida; aluno com duas mensalidades vencidas fica bloqueado e não pode entrar até regularizar. a gerência vê um painel com total a receber no mês, total recebido, quantidade de alunos ativos, bloqueados e inadimplentes. o aluno pode cancelar a matrícula, o que encerra a geração de mensalidades futuras. perfis: recepção e gerência.",
  "actors": [
    {
      "actorId": "recepcao",
      "kind": "internal",
      "origin": "named",
      "title": "Recepção",
      "description": "Profissional da academia que matricula alunos em planos e registra pagamentos de mensalidades."
    },
    {
      "actorId": "gerencia",
      "kind": "internal",
      "origin": "named",
      "title": "Gerência",
      "description": "Profissional da academia que gera mensalidades mensais e acompanha indicadores financeiros e de alunos."
    },
    {
      "actorId": "aluno",
      "kind": "external",
      "origin": "inferred",
      "title": "Aluno",
      "description": "Pessoa matriculada na academia que pode cancelar a própria matrícula."
    }
  ]
}
